### ISSUE TITLE
keepalive机制

### ISSUE THREAD

**Issue by WALL-E** [WALL-E/tcp-ip-labs#4]
**Linux中没有全局去开启keepalive的选项，必须在应用中socket中单独开启**

net.ipv4.tcp_keepalive_time = 7200
net.ipv4.tcp_keepalive_probes = 9
net.ipv4.tcp_keepalive_intvl = 75

**Comment by WALL-E** [comment]
* tcp_keepalive_time
the interval between the last data packet sent (simple ACKs are not considered data) and the first keepalive probe; after the connection is marked to need keepalive, this counter is not used any further

* tcp_keepalive_intvl
the interval between subsequential keepalive probes, regardless of what the connection has exchanged in the meantime

* tcp_keepalive_probes
the number of unacknowledged probes to send before considering the connection dead and notifying the application layer

**Comment by WALL-E** [comment]
实验步骤
> 过程中需要打开两个终端，连接不同的服务器
> 终端1:192.168.1.102
> 终端2:192.168.1.150
> 终端3:192.168.1.150
> 需要安装sock工具，参见https://github.com/WALL-E/sock


1. 【终端1】修改keepalive系统参数
```
sysctl -w net.ipv4.tcp_keepalive_time=60
sysctl -w net.ipv4.tcp_keepalive_probes=9
sysctl -w net.ipv4.tcp_keepalive_intvl=15
```
2. 【终端2】清空防火墙规则
```
iptables -F
```
3. 【终端3】启动tcpdump，查看网路数据包
```
tcpdump -i any host 192.168.1.102 and tcp -nnn -tt
```
4. 【终端1】连接192.168.1.150的22端口
```
sock -K 192.168.1.150 22
```
5. 【终端2】修改防火墙规则，模拟网络断开
```
iptables -I OUTPUT -p tcp -d 192.168.1.102 -j DROP
```
6. 【终端3】查看tcpdump的输出
```
[root@localhost ~]# tcpdump -i any host 192.168.1.102 and tcp -nnn -tt
tcpdump: verbose output suppressed, use -v or -vv for full protocol decode
listening on any, link-type LINUX_SLL (Linux cooked), capture size 65535 bytes
1499612992.733871 IP 192.168.1.102.37226 > 192.168.1.150.22: Flags [S], seq 1939683102, win 14600, options [mss 1460,sackOK,TS val 14309440 ecr 0,nop,wscale 7], length 0
1499612992.734037 IP 192.168.1.150.22 > 192.168.1.102.37226: Flags [S.], seq 289803816, ack 1939683103, win 14480, options [mss 1460,sackOK,TS val 14322157 ecr 14309440,nop,wscale 7], length 0
1499612992.735603 IP 192.168.1.102.37226 > 192.168.1.150.22: Flags [.], ack 1, win 115, options [nop,nop,TS val 14309443 ecr 14322157], length 0
1499612992.761154 IP 192.168.1.150.22 > 192.168.1.102.37226: Flags [P.], seq 1:22, ack 1, win 114, options [nop,nop,TS val 14322184 ecr 14309443], length 21
1499612992.761470 IP 192.168.1.102.37226 > 192.168.1.150.22: Flags [.], ack 22, win 115, options [nop,nop,TS val 14309469 ecr 14322184], length 0

1499613052.761781 IP 192.168.1.102.37226 > 192.168.1.150.22: Flags [.], ack 22, win 115, options [nop,nop,TS val 14369470 ecr 14322184], length 0
1499613067.762701 IP 192.168.1.102.37226 > 192.168.1.150.22: Flags [.], ack 22, win 115, options [nop,nop,TS val 14384471 ecr 14322184], length 0
1499613082.763531 IP 192.168.1.102.37226 > 192.168.1.150.22: Flags [.], ack 22, win 115, options [nop,nop,TS val 14399471 ecr 14322184], length 0
1499613097.764632 IP 192.168.1.102.37226 > 192.168.1.150.22: Flags [.], ack 22, win 115, options [nop,nop,TS val 14414472 ecr 14322184], length 0
1499613112.765362 IP 192.168.1.102.37226 > 192.168.1.150.22: Flags [.], ack 22, win 115, options [nop,nop,TS val 14429473 ecr 14322184], length 0
1499613127.765379 IP 192.168.1.102.37226 > 192.168.1.150.22: Flags [.], ack 22, win 115, options [nop,nop,TS val 14444473 ecr 14322184], length 0
1499613142.765042 IP 192.168.1.102.37226 > 192.168.1.150.22: Flags [.], ack 22, win 115, options [nop,nop,TS val 14459473 ecr 14322184], length 0
1499613157.765114 IP 192.168.1.102.37226 > 192.168.1.150.22: Flags [.], ack 22, win 115, options [nop,nop,TS val 14474473 ecr 14322184], length 0
1499613172.764997 IP 192.168.1.102.37226 > 192.168.1.150.22: Flags [.], ack 22, win 115, options [nop,nop,TS val 14489473 ecr 14322184], length 0
1499613187.764907 IP 192.168.1.102.37226 > 192.168.1.150.22: Flags [R.], seq 1, ack 22, win 115, options [nop,nop,TS val 14504473 ecr 14322184], length 0
```
7.【终端1】sock程序，心跳包探测失败后退出
```
[root@localhost sock-1.0]# sock -K 192.168.1.150 22
SSH-2.0-OpenSSH_5.3
recv error: Connection timed out
```
