### ISSUE TITLE
TCP重试机制

### ISSUE THREAD

**Issue by WALL-E** [WALL-E/tcp-ip-labs#1]
查看系统中和TCP重试相关的所有参数
```
[root@localhost ~]# sysctl -a|grep tcp|grep retri
net.ipv4.tcp_syn_retries = 2
net.ipv4.tcp_synack_retries = 5
net.ipv4.tcp_retries1 = 3
net.ipv4.tcp_retries2 = 15
```

**Comment by WALL-E** [comment]
# tcp_syn_retries
实验步骤
> 过程中需要打开两个终端

1.【终端1】 查看系统当前配置
```
[root@localhost ~]# sysctl net.ipv4.tcp_syn_retries
net.ipv4.tcp_syn_retries = 2
```
2. 【终端2】运行Tcpdump命令查看网络数据包
```
[root@localhost ~]# tcpdump -i any host 1.1.1.1 
tcpdump: verbose output suppressed, use -v or -vv for full protocol decode
listening on any, link-type LINUX_SLL (Linux cooked), capture size 65535 bytes
```
3. 【终端1】连接远程主机1.1.1.1的telnet服务
```
[root@localhost ~]# telnet 1.1.1.1
Trying 1.1.1.1...
telnet: connect to address 1.1.1.1: Connection timed out
```
4.【终端2】 查看TCPdump的输出
```
[root@localhost ~]# tcpdump -i any host 1.1.1.1 
tcpdump: verbose output suppressed, use -v or -vv for full protocol decode
listening on any, link-type LINUX_SLL (Linux cooked), capture size 65535 bytes
19:28:11.347186 IP 192.168.1.150.59774 > 1.1.1.1.telnet: Flags [S], seq 142364625, win 14600, options [mss 1460,sackOK,TS val 36341418 ecr 0,nop,wscale 7], length 0
19:28:12.347007 IP 192.168.1.150.59774 > 1.1.1.1.telnet: Flags [S], seq 142364625, win 14600, options [mss 1460,sackOK,TS val 36342418 ecr 0,nop,wscale 7], length 0
19:28:14.347117 IP 192.168.1.150.59774 > 1.1.1.1.telnet: Flags [S], seq 142364625, win 14600, options [mss 1460,sackOK,TS val 36344418 ecr 0,nop,wscale 7], length 0
```
5. 结论
当tcp_syn_retries设置为2的时候，系统会发出3个SYN，其中有两个是重试。重试时间的间隔是1秒，然后指数定增，简单来说是1秒，2秒，4秒，8秒，16秒......

练习：当tcp_syn_retries设置为20的时候，重试时间间隔是什么规律，大家可以试试

**Comment by WALL-E** [comment]
# tcp_synack_retries
实验步骤
> 过程中需要打开两个终端，连接不同的服务器
> 终端1:192.168.1.102
> 终端2:192.168.1.150

1.【终端1】 查看系统当前配置
```
[root@localhost ~]# sysctl net.ipv4.tcp_synack_retries
net.ipv4.tcp_synack_retries = 5
```
2. 【终端1】 添加防火墙规则，丢弃三次握手中的ack响应
```
iptables -I OUTPUT -p tcp --dport 22 --tcp-flags ACK ACK -j DROP
```
3. 【终端2】运行tcpdump
```
 tcpdump -i any host 192.168.1.102 and tcp -nnn -tt
```
4. 【终端1】启动telnet连接
```
[root@localhost ~]# telnet 192.168.1.150 22
Trying 192.168.1.150...
Connected to 192.168.1.150.
Escape character is '^]'.
```
5. 【终端2】查看tcpdump输出
```
 tcpdump -i any host 192.168.1.102 and tcp -nnn -tt
1499599214.485090 IP 192.168.1.102.37144 > 192.168.1.150.22: Flags [S], seq 1533112361, win 14600, options [mss 1460,sackOK,TS val 531179 ecr 0,nop,wscale 7], length 0
1499599214.485182 IP 192.168.1.150.22 > 192.168.1.102.37144: Flags [S.], seq 596642422, ack 1533112362, win 14480, options [mss 1460,sackOK,TS val 543908 ecr 531179,nop,wscale 7], length 0
1499599216.057766 IP 192.168.1.150.22 > 192.168.1.102.37144: Flags [S.], seq 596642422, ack 1533112362, win 14480, options [mss 1460,sackOK,TS val 545481 ecr 531179,nop,wscale 7], length 0
1499599218.064851 IP 192.168.1.150.22 > 192.168.1.102.37144: Flags [S.], seq 596642422, ack 1533112362, win 14480, options [mss 1460,sackOK,TS val 547488 ecr 531179,nop,wscale 7], length 0
1499599222.080056 IP 192.168.1.150.22 > 192.168.1.102.37144: Flags [S.], seq 596642422, ack 1533112362, win 14480, options [mss 1460,sackOK,TS val 551503 ecr 531179,nop,wscale 7], length 0
1499599230.122605 IP 192.168.1.150.22 > 192.168.1.102.37144: Flags [S.], seq 596642422, ack 1533112362, win 14480, options [mss 1460,sackOK,TS val 559546 ecr 531179,nop,wscale 7], length 0
1499599246.181300 IP 192.168.1.150.22 > 192.168.1.102.37144: Flags [S.], seq 596642422, ack 1533112362, win 14480, options [mss 1460,sackOK,TS val 575605 ecr 531179,nop,wscale 7], length 0
```
5. 结论
当tcp_syn_retries设置为5的时候，系统会发出6个SYN/ACK，其中有两个是重试。重试时间的间隔是1秒，然后指数定增，简单来说是1秒，2秒，4秒，8秒，16秒......

练习：当tcp_syn_retries设置为20的时候，重试时间间隔是什么规律，大家可以试试

**Comment by WALL-E** [comment]
# tcp_retries1&tcp_retries2
* /proc/sys/net/ipv4/tcp_retries1 (integer; default: 3)
TCP尝试了3次（tcp_retries1默认3）重传后，还没有收到ACK的话，则后续每次重传都需要network layer先更新路由。

* /proc/sys/net/ipv4/tcp_retries2 (integer; default: 15)
TCP默认最多做15次重传。根据RTO(retransmission timeout)不同，最后一次重传间隔大概是13到30分钟左右。如果15次重传都做完了，TCP/IP就会告诉应用层说：“搞不定了，包怎么都传不过去！”

实验步骤
> 过程中需要打开两个终端，连接不同的服务器
> 终端1:192.168.1.102
> 终端2:192.168.1.150

1.【终端2】 查看系统当前配置
```
[root@localhost ~]# sysctl net.ipv4.tcp_retries1
net.ipv4.tcp_retries1 = 3
[root@localhost ~]# sysctl net.ipv4.tcp_retries2
net.ipv4.tcp_retries2 = 15
```
2. 【终端2】 添加防火墙规则，丢弃ack响应
```
iptables -I OUTPUT -p tcp --sport 22 -d 192.168.1.102 --tcp-flags SYN,ACK ACK -j DROP
```
3.  【终端2】 启动tcpdump，观察数据包
```
[root@localhost ~]# tcpdump -i any host 192.168.1.102 and tcp -nnn -tt
tcpdump: verbose output suppressed, use -v or -vv for full protocol decode
listening on any, link-type LINUX_SLL (Linux cooked), capture size 65535 bytes
```
4. 【终端1】 连接192.168.1.150的22端口，并输入一个回车，出发发送数据包
```
[root@localhost ~]# telnet 192.168.1.150 22
[root@localhost ~]# telnet 192.168.1.150 22
Trying 192.168.1.150...
Connected to 192.168.1.150.
Escape character is '^]'.


Connection closed by foreign host.
```
5. 【终端2】 查看tcpdump的输出
```
[root@localhost ~]# tcpdump -i any host 192.168.1.102 and tcp -nnn -tt
tcpdump: verbose output suppressed, use -v or -vv for full protocol decode
listening on any, link-type LINUX_SLL (Linux cooked), capture size 65535 bytes
1499607370.543164 IP 192.168.1.102.37146 > 192.168.1.150.22: Flags [S], seq 443569438, win 14600, options [mss 1460,sackOK,TS val 8687245 ecr 0,nop,wscale 7], length 0
1499607370.543352 IP 192.168.1.150.22 > 192.168.1.102.37146: Flags [S.], seq 3161457122, ack 443569439, win 14480, options [mss 1460,sackOK,TS val 8699966 ecr 8687245,nop,wscale 7], length 0
1499607370.549039 IP 192.168.1.102.37146 > 192.168.1.150.22: Flags [.], ack 1, win 115, options [nop,nop,TS val 8687250 ecr 8699966], length 0
1499607442.758241 IP 192.168.1.102.37146 > 192.168.1.150.22: Flags [P.], seq 1:3, ack 1, win 115, options [nop,nop,TS val 8759460 ecr 8699966], length 2
1499607442.963636 IP 192.168.1.102.37146 > 192.168.1.150.22: Flags [P.], seq 1:3, ack 1, win 115, options [nop,nop,TS val 8759666 ecr 8699966], length 2
1499607443.373680 IP 192.168.1.102.37146 > 192.168.1.150.22: Flags [P.], seq 1:3, ack 1, win 115, options [nop,nop,TS val 8760076 ecr 8699966], length 2
1499607444.193697 IP 192.168.1.102.37146 > 192.168.1.150.22: Flags [P.], seq 1:3, ack 1, win 115, options [nop,nop,TS val 8760896 ecr 8699966], length 2
1499607445.833959 IP 192.168.1.102.37146 > 192.168.1.150.22: Flags [P.], seq 1:3, ack 1, win 115, options [nop,nop,TS val 8762536 ecr 8699966], length 2
1499607449.115040 IP 192.168.1.102.37146 > 192.168.1.150.22: Flags [P.], seq 1:3, ack 1, win 115, options [nop,nop,TS val 8765818 ecr 8699966], length 2
1499607455.675434 IP 192.168.1.102.37146 > 192.168.1.150.22: Flags [P.], seq 1:3, ack 1, win 115, options [nop,nop,TS val 8772378 ecr 8699966], length 2
1499607468.796226 IP 192.168.1.102.37146 > 192.168.1.150.22: Flags [P.], seq 1:3, ack 1, win 115, options [nop,nop,TS val 8785499 ecr 8699966], length 2
1499607495.036785 IP 192.168.1.102.37146 > 192.168.1.150.22: Flags [P.], seq 1:3, ack 1, win 115, options [nop,nop,TS val 8811739 ecr 8699966], length 2
1499607547.517912 IP 192.168.1.102.37146 > 192.168.1.150.22: Flags [P.], seq 1:3, ack 1, win 115, options [nop,nop,TS val 8864221 ecr 8699966], length 2
1499607652.478220 IP 192.168.1.102.37146 > 192.168.1.150.22: Flags [P.], seq 1:3, ack 1, win 115, options [nop,nop,TS val 8969181 ecr 8699966], length 2
1499607772.478458 IP 192.168.1.102.37146 > 192.168.1.150.22: Flags [P.], seq 1:3, ack 1, win 115, options [nop,nop,TS val 9089181 ecr 8699966], length 2
1499607892.478179 IP 192.168.1.102.37146 > 192.168.1.150.22: Flags [P.], seq 1:3, ack 1, win 115, options [nop,nop,TS val 9209181 ecr 8699966], length 2
1499608012.478282 IP 192.168.1.102.37146 > 192.168.1.150.22: Flags [P.], seq 1:3, ack 1, win 115, options [nop,nop,TS val 9329181 ecr 8699966], length 2
1499608132.478435 IP 192.168.1.102.37146 > 192.168.1.150.22: Flags [P.], seq 1:3, ack 1, win 115, options [nop,nop,TS val 9449182 ecr 8699966], length 2
1499608252.478611 IP 192.168.1.102.37146 > 192.168.1.150.22: Flags [P.], seq 1:3, ack 1, win 115, options [nop,nop,TS val 9569182 ecr 8699966], length 2
```
5. 结论
客户端在重试15次之后，系统认为我已经无能为力了，告诉应用程序该放弃了。整个重试时间持续了812秒，不到14分钟。

练习: 怎么确认系统有没有更新路由，目前没有什么好办法，以后遇到再说吧。

REF: http://www.orczhou.com/index.php/2011/10/tcpip-protocol-start-rto/
